{
  "$schema": "http://json-schema.org/draft-07/schema#",
  "$id": "https://raw.githubusercontent.com/idmdakhi/GitCommitMessageEditor-vsce/refs/heads/main/schemas/v1-template.schema.json",
  "title": "Git Commit Message Editor — Template",
  "description": "A complete and self‑contained commit message template. This structure is used in the extension's internal folder (templates/) and in user‑saved templates in the repository (.vscode/commit-templates/).",
  "type": "object",
  "additionalProperties": false,
  "required": ["version", "name", "template", "tokens"],
  "properties": {
    "$schema": {
      "type": "string",
      "description": "Optional — to enable Autocomplete/validation in the editor."
    },
    "version": {
      "type": "string",
      "const": "1",
      "description": "Template structure version. Currently always \"1\"."
    },
    "name": {
      "type": "string",
      "minLength": 1,
      "description": "Template name. Displayed in the 'Active template' dropdown and at the top of the form.",
      "examples": ["Conventional Commits", "Backend Team Contract"]
    },
    "template": {
      "type": "array",
      "minItems": 1,
      "description": "Final commit message structure, line by line. Each {tokenName} is replaced with the token's value. Lines where all tokens are empty are automatically removed; consecutive empty lines are collapsed.",
      "items": { "type": "string" },
      "examples": [["{type}{scope}{subject}", "", "{body}", "", "{closes}"]]
    },
    "tokens": {
      "type": "array",
      "minItems": 1,
      "description": "List of form fields, in the order they should be displayed.",
      "items": { "$ref": "#/definitions/token" }
    }
  },
  "definitions": {
    "tokenOption": {
      "type": "object",
      "additionalProperties": false,
      "required": ["label"],
      "properties": {
        "label": {
          "type": "string",
          "description": "Text that will be inserted into the final message (e.g. an emoji or word)."
        },
        "description": {
          "type": "string",
          "description": "Short description shown below the option icon/label."
        }
      }
    },
    "token": {
      "type": "object",
      "additionalProperties": false,
      "required": ["label", "name", "type"],
      "properties": {
        "label": {
          "type": "string",
          "description": "Field label in the form (Persian or English, whatever you want)."
        },
        "name": {
          "type": "string",
          "pattern": "^[a-zA-Z][a-zA-Z0-9]*$",
          "description": "Unique English identifier for this token; referenced in the template as {name}. Only English letters/digits, no spaces."
        },
        "type": {
          "type": "string",
          "enum": ["text", "boolean", "enum"],
          "description": "text: free text input (single‑line or multiline). boolean: simple checkbox. enum: selection grid with predefined options."
        },
        "description": {
          "type": "string",
          "description": "Help description below the field label in the form."
        },
        "prefix": {
          "type": "string",
          "description": "Text prepended to the value (if non‑empty). Example: 'Closes: ' or '('."
        },
        "suffix": {
          "type": "string",
          "description": "Text appended to the value (if non‑empty). Example: ')'."
        },
        "required": {
          "type": "boolean",
          "description": "If true, it appears as red/required on the status dashboard and warns when empty."
        },
        "conditional": {
          "type": "boolean",
          "description": "Reserved; in the current version all non‑required fields are automatically shown behind a state of 'active/inactive based on value'."
        },
        "value": {
          "type": "string",
          "description": "Only for type=boolean: text inserted when the checkbox is checked."
        },
        "multiline": {
          "type": "boolean",
          "description": "Only for type=text: display as a multiline textarea instead of a single‑line input."
        },
        "monospace": {
          "type": "boolean",
          "description": "Only for type=text with multiline=true: use the editor's monospace font."
        },
        "lines": {
          "type": "integer",
          "minimum": 1,
          "description": "Only for type=text with multiline=true: initial number of rows of the textarea."
        },
        "maxLines": {
          "type": "integer",
          "minimum": 1,
          "description": "Only for type=text with multiline=true: maximum number of lines (informational)."
        },
        "maxLength": {
          "type": "integer",
          "minimum": 1,
          "description": "Only for type=text: maximum character length; shows a live counter below the field."
        },
        "maxLineLength": {
          "type": "integer",
          "minimum": 1,
          "description": "Only for type=text with multiline=true: warns if a line exceeds this length."
        },
        "issueList": {
          "type": "boolean",
          "description": "Only for type=text: processes the value as a list of issue numbers and prepends # to each."
        },
        "perLine": {
          "type": "boolean",
          "description": "Only for type=text with multiline=true: applies prefix/suffix to each non‑empty line separately."
        },
        "multiple": {
          "type": "boolean",
          "description": "Only for type=enum (reserved for future development: multiple selection)."
        },
        "separator": {
          "type": "string",
          "description": "Only for type=enum with multiple=true (reserved for future development)."
        },
        "combobox": {
          "type": "boolean",
          "description": "Only for type=enum: display as an icon grid instead of a simple dropdown."
        },
        "options": {
          "type": "array",
          "minItems": 1,
          "description": "Only for type=enum: list of options. Required.",
          "items": { "$ref": "#/definitions/tokenOption" }
        }
      },
      "allOf": [
        {
          "if": { "properties": { "type": { "const": "enum" } } },
          "then": { "required": ["options"] }
        }
      ]
    }
  }
}
